{
  "$schema": "https://json-schema.org/draft/2020-12/schema",
  "$id": "urn:sylvia:schema:receipt:v1",
  "title": "Delivery receipt",
  "description": "Body of POST /v1/receipts from the phone (plan 15.3, 16.2). receipt_id is the idempotency key: the same receipt_id with the same body is acknowledged again without changing state, the same receipt_id with a different body is a 409 conflict. 'Queued on Mac' is the Mac's own state and is never sent as a receipt; the phone reports downloaded_to_phone (all bytes verified on the phone), imported_into_sylvia (the library item committed) or import_failed (with a failure; the Mac keeps the entry for retry). A receipt never deletes the original source file.",
  "type": "object",
  "required": ["schema_version", "receipt_id", "queue_entry_id", "item_id", "item_version_id", "state", "occurred_at"],
  "properties": {
    "schema_version": { "const": 1 },
    "receipt_id": { "$ref": "#/$defs/uuid" },
    "queue_entry_id": {
      "description": "The device-inbox entry this receipt is for, or null for an item fetched from the catalog without a queue entry.",
      "oneOf": [{ "$ref": "#/$defs/uuid" }, { "type": "null" }]
    },
    "item_id": { "$ref": "#/$defs/uuid" },
    "item_version_id": { "$ref": "#/$defs/uuid" },
    "state": { "enum": ["downloaded_to_phone", "imported_into_sylvia", "import_failed"] },
    "occurred_at": {
      "type": "string",
      "format": "date-time",
      "pattern": "^[0-9]{4}-[0-9]{2}-[0-9]{2}T[0-9]{2}:[0-9]{2}:[0-9]{2}(\\.[0-9]+)?Z$"
    },
    "failure": {
      "description": "Required for import_failed; absent otherwise. The message is shown on the Mac and must not contain titles, paths, notes or selected text.",
      "type": "object",
      "required": ["code", "message"],
      "properties": {
        "code": { "type": "string", "pattern": "^[a-z][a-z0-9_]{0,63}$" },
        "message": { "type": "string", "minLength": 1, "maxLength": 512 }
      }
    }
  },
  "if": { "properties": { "state": { "const": "import_failed" } } },
  "then": { "required": ["failure"] },
  "else": { "not": { "required": ["failure"] } },
  "$defs": {
    "uuid": {
      "type": "string",
      "minLength": 36,
      "maxLength": 36,
      "pattern": "^[0-9a-f]{8}-[0-9a-f]{4}-[0-9a-f]{4}-[0-9a-f]{4}-[0-9a-f]{12}$"
    }
  }
}
