{"item_id":"e5bfba26-12ae-443c-8ae4-47e62dcccadb","item_version_id":"638b0ea8-63ca-4142-8598-3bd0deb7ed77","occurred_at":"2026-10-12T21:01:46Z","queue_entry_id":"60c2ca79-e6ba-416c-b986-6113db9c3ee8","receipt_id":"c4dee0a1-2479-40ef-a465-6f2edb73f300","schema_version":1,"state":"imported_into_sylvia"}