{
  "schema_version": 1,
  "receipt_id": "00000000-0000-4000-8000-000000000a02",
  "queue_entry_id": "00000000-0000-4000-8000-000000000e01",
  "item_id": "00000000-0000-4000-8000-000000000001",
  "item_version_id": "00000000-0000-4000-8000-000000000002",
  "state": "imported_into_sylvia",
  "occurred_at": "2026-10-06T09:05:00Z"
}
