{"item_id":"8afe3cee-7436-4d88-9177-f94a10a6c273","item_version_id":"36e4399a-2093-4b1c-89e3-48b888a90521","occurred_at":"2026-10-19T04:24:26Z","queue_entry_id":"7544a926-86ac-44a0-855f-9e6224d6c254","receipt_id":"25c127af-3071-4409-8f77-668ab4ef3a50","schema_version":1,"state":"imported_into_sylvia"}