{"item_id":"b69fb262-4adf-4917-b2ef-e8652fbf0df8","item_version_id":"2c62ce4d-2465-4a96-8826-e05c6645ffa8","occurred_at":"2026-10-12T03:02:18Z","queue_entry_id":"d1fff6d6-5c80-4e67-ad13-ffc4dc16d5c9","receipt_id":"63933e5d-5b60-4477-a952-e98870d3e148","schema_version":1,"state":"downloaded_to_phone"}