{"item_id":"cdb7d389-9f37-4d21-a774-b759080d54c1","item_version_id":"0e2c09b9-0188-4b2e-a1d1-3e75a6666ecf","occurred_at":"2026-10-19T14:23:33Z","queue_entry_id":"9bd35215-5534-485c-90a9-e5895718da5c","receipt_id":"154959c4-d524-48de-87bb-dfe365b5b56e","schema_version":1,"state":"imported_into_sylvia"}